name,category,description,pricePerUnit,ingredients,recipe,disabled
Classic Vanilla Cake,Cake,"Delight in the timeless elegance of our Classic Vanilla Cake. Moist and tender, with a rich vanilla flavor that enchants the palate with every bite.",15.00,"Flour,250.00;Sugar,225.00;Butter,225.00;Eggs,4;Vanilla extract,10.00;Baking powder,10.00;Milk,120.00","1.Add flour, sugar, baking powder, butter, vanilla extract and salt in a large bowl and mix,2.Add eggs, milk and mix with low speed,3.Mix till smooth and insert batter in heated pan,4.Bake the cake within 40 minutes until golden,5.Remove from the oven and allow to cool for about 10 minutes,6.Apply frosting with Vanilla Frosting",false
Chocolate Cake,Cake,"Indulge in the rich, velvety decadence of our Chocolate Cake. Made with premium cocoa and a blend of fine ingredients, this cake is a true celebration of chocolate.",17.50,"Flour,250.00;Sugar,225.00;Butter,225.00;Eggs,4;Vanilla extract,10.00;Baking powder,10.00;Milk,120.00;Cocoa powder,50.00","1.Add flour, sugar, baking powder, butter, vanilla extract, cocoa powder and salt in a large bowl and mix,2.Add eggs, milk and mix with low speed,3.Mix till smooth and insert batter in heated pan,4.Bake the cake within 50 minutes until golden,5.Remove from the oven and allow to cool for about 10 minutes,6.Apply frosting with Chocolate Frosting",false
Lemon Cake,Cake,"Savor the bright and zesty flavors of our Lemon Cake. Made with fresh lemon juice and zest, this cake is a refreshing treat that is perfect for any occasion.",17.50,"Flour,250.00;Sugar,300.00;Butter,225.00;Eggs,4;Vanilla extract,10.00;Baking powder,10.00;Lemon,1","1.Add flour, sugar, baking powder, butter, vanilla extract and salt in a large bowl and mix,2.Add eggs, milk, lemon zest and mix with low speed,3.Mix till smooth and insert batter in heated pan,4.Bake the cake between 30-50 minutes until golden,5.Remove from the oven and allow to cool for about 10 minutes,6.Apply frosting with Lemon Frosting",false
Eid Cookies,Cookie,"Celebrate the joyous occasion of Eid with our delightful Eid cookies. These tender treats are super buttery , dusted with powdered sugar, with a delicious surprise in the middle.",15.50,"Flour,200.00;Sugar,100.00;Ghee,100.00;Eggs,2;Pistachio nuts,50.00;Baking powder,10.00;Salt,5.00","1.Mix flour, salt, sugar, baking powder and pistachio nuts,2.Add ghee into the mixture and stir well until a consistent shape is formed,3.Combine flour, baking powder,salt and cook the flour until golden brown,4.Insert the mixture from step 1 into the dough and roll the dough into balls,5.Bake at 350°F for 8-10 minutes or until edges are golden brown,6.Spread powdered sugar across the baked cookies",false
Vanilla Cookies,Cookie,"Enjoy the simple pleasures of our Vanilla Cookies. These buttery cookies are made with pure vanilla extract and are perfect for any occasion.",10.00,"Flour,200.00;Sugar,100.00;Butter,100.00;Eggs,2;Vanilla extract,10.00;Baking powder,10.00;Salt,5.00","1.Mix butter, sugar, and vanilla and whisk until fluffy,2.Add egg, and mix until just combined,3.Scoop, roll, and coat dough in granulated sugar,4.Bake until edges are set and slightly golden,5.Reshape with a round cookie cutter,6.Cool on wire racks",false